{"process_instance_id":"4ED596EB-3A90-4202-BEB3-3A18F8957218","source_baseline":"d1453434ceefe73bef5aff497194e09f39dde7e1","package_role":"INDEPENDENT_RUNTIME_DIAGNOSTICS","expected_package_identity":true,"package_version":"0.1.3.0","identities":{"diagnostic_exe_sha256":"89997350241657405fc38e596788c91b45c9e5978288d066ece51e3f42a4a6b9","package_manifest_sha256":"68e2b1a0a418593f6c768d5c4df044574e36b876276903c684eb18fe6a18065a","input_manifest_sha256":"b53990c9ef4c4211d7c88c33b547b043ec14bef8258b2089dd29e5ad0c102404","runtime_inventory_sha256":"a847983740065493a4e5e106aada42b355f7d1b5955cedc39dd5bf36649915c1","profile_sha256":"d27605ed090789a49f9f0e171b21a79470af27cae829c904c427f55bebe6f8e8"},"schema":"legacyforge-phase6b1-runtime-receipt-v1","case_id":"D00","run_id":"0799F3FD-1056-4709-9302-202AA86C4C5D","status":"PASS","stage":"FINAL","reason":"D00_ACTIVATED_HASHES_RECORDED","observed_at_utc":"2026-10-17T19:33:43.607Z","sequence":2,"elapsed_monotonic_ms":31,"terminal":true,"minecraft_or_gameplay_tested":false,"authentication_or_entitlements_modified":false,"details":{"expected_package_identity":true,"source_baseline":"d1453434ceefe73bef5aff497194e09f39dde7e1","scope":"D00_ACTIVATION_IDENTITIES_RESOURCES_ONLY","jvm_loaded":false,"graphics_capability_tested":false,"input_capability_tested":false,"audio_capability_tested":false,"native_dependency_closure_tested":false,"resources":{"app_memory_usage_bytes":35020800,"app_memory_limit_bytes":1073741824,"memory_manager_available":true,"working_set_bytes":61108224,"peak_working_set_bytes":61108224,"private_page_count_reported":15564800,"process_memory_available":true,"cpu_measured":false,"gpu_measured":false},"role_hashes":{"diagnostic_exe_sha256":"89997350241657405fc38e596788c91b45c9e5978288d066ece51e3f42a4a6b9","package_manifest_sha256":"68e2b1a0a418593f6c768d5c4df044574e36b876276903c684eb18fe6a18065a","input_manifest_sha256":"b53990c9ef4c4211d7c88c33b547b043ec14bef8258b2089dd29e5ad0c102404","runtime_inventory_sha256":"a847983740065493a4e5e106aada42b355f7d1b5955cedc39dd5bf36649915c1","profile_sha256":"d27605ed090789a49f9f0e171b21a79470af27cae829c904c427f55bebe6f8e8"},"required_role_hashes_complete":true},"last_durable_checkpoint_stage":"D00_ACTIVATION_STARTED","last_durable_checkpoint_details":{"jvm_loaded":false,"ui_render_is_d06_test":false}}